title,published,link,summary,source,geopolitical_risk_score
The AI trade still 'has legs': Wall Street analysts weigh tech stock picks amid market sell-off,2026-03-08 14:00:03+00:00,https://finance.yahoo.com/news/the-ai-trade-still-has-legs-wall-street-analysts-weigh-tech-stock-picks-amid-market-sell-off-140003840.html,,Yahoo Finance (Global),0.0
Crude oil prices surpass $100 a barrel as the Iran war impedes production and shipping,2026-03-08 22:19:22+00:00,https://finance.yahoo.com/news/crude-oil-prices-surpass-100-221922295.html,,Yahoo Finance (Global),0.2222222222222222
"Freedom Capital Turns Cautious on Tennant (TNC), Downgrades Stock to Hold",2026-03-09 01:16:38+00:00,https://finance.yahoo.com/news/freedom-capital-turns-cautious-tennant-011638243.html,,Yahoo Finance (Global),0.0
"Baird Sees Strong Earnings Potential, Upgrades RPM to Outperform",2026-03-09 01:19:02+00:00,https://finance.yahoo.com/news/baird-sees-strong-earnings-potential-011902536.html,,Yahoo Finance (Global),0.0
ABM Industries (ABM) to Provide Integrated Facility Services at Citizens Bank Park,2026-03-09 01:31:49+00:00,https://finance.yahoo.com/news/abm-industries-abm-integrated-facility-013149985.html,,Yahoo Finance (Global),0.0
California Water Service (CWT) Expands With Nexus Water Systems Deal,2026-03-09 01:34:09+00:00,https://finance.yahoo.com/news/california-water-cwt-expands-nexus-013409337.html,,Yahoo Finance (Global),0.0
"HELOC and home equity loan rates Monday, March 9, 2026: Got a low rate? Now consider this.",2026-03-09 10:00:48+00:00,https://finance.yahoo.com/personal-finance/mortgages/article/heloc-home-equity-loan-rates-today-monday-march-9-2026-100048612.html,,Yahoo Finance (Global),0.0
Tax refund delays hit 5 states. Is yours one of them?,2026-03-05 20:52:25+00:00,https://finance.yahoo.com/personal-finance/taxes/article/tax-refund-delays-hit-5-states-is-yours-one-of-them-205225811.html,,Yahoo Finance (Global),0.0
3 Things The Trade Desk Must Prove in 2026,2026-03-08 20:35:00+00:00,https://finance.yahoo.com/news/3-things-trade-desk-must-203500689.html,,Yahoo Finance (Global),0.0
